{
  "$schema": "../../schemas/pbi02/pbi02_metric_catalog.schema.json",
  "artifact_id": "PBI02_MICHIGAN_MAP_METRIC_CATALOG_V1",
  "version": "1.0.0",
  "status": "active",
  "expected_metric_count": 16,
  "missing_value_policy": "Blank, missing, invalid, inapplicable, and noncomputable values remain unavailable, never become zero, never participate in a robust domain, and use the neutral No Data / Unavailable treatment.",
  "metrics": [
    {
      "metric_key": "customer_fit_percentile",
      "source_authority_id": "MODEL13_MICHIGAN_POWER_BI_OUTPUT_CONTRACT_V1",
      "family": "model_proxy",
      "display_name": "Customer Fit Percentile",
      "short_name": "Customer Fit",
      "sort_order": 1,
      "unit": "statewide percentile",
      "format_policy": "percentile_1",
      "definition": "Percentile position of the accepted customer-fit public-data proxy among computable Michigan tracts.",
      "interpretation": "Use as relative statewide decision support. It is not Sprouts' proprietary customer model and is not a final site recommendation.",
      "source_label": "Accepted MODEL-13 Michigan public-data proxy output",
      "vintage_label": "2024 public-source inputs",
      "scale_policy": "fixed_0_100",
      "availability_category": "model13_computability",
      "contextual_warning_policy": "model_noncomputability_and_relevant_support",
      "palette": "blue_teal_sequential",
      "binding": {"table": "Michigan Tracts", "column": "Customer Fit Percentile"}
    },
    {
      "metric_key": "household_opportunity_5_mile",
      "source_authority_id": "MODEL13_MICHIGAN_POWER_BI_OUTPUT_CONTRACT_V1",
      "family": "household_opportunity",
      "display_name": "5-Mile Household Opportunity",
      "short_name": "Household Opportunity",
      "sort_order": 2,
      "unit": "households",
      "format_policy": "count_0",
      "definition": "Accepted raw five-mile B11001 household opportunity mass around the tract's public internal-point anchor.",
      "interpretation": "This describes household opportunity mass, not customer fit, a site-level forecast, or a recommendation.",
      "source_label": "Accepted MODEL-13 Michigan household opportunity output",
      "vintage_label": "2024 ACS 5-year / 2024 TIGER",
      "scale_policy": "statewide_valid_p02_p98",
      "availability_category": "model13_household_support",
      "contextual_warning_policy": "five_mile_support_truncation",
      "palette": "blue_teal_sequential",
      "binding": {"table": "Michigan Tracts", "column": "Household Opportunity"}
    },
    {
      "metric_key": "modeled_target_mass_percentile",
      "source_authority_id": "MODEL13_MICHIGAN_POWER_BI_OUTPUT_CONTRACT_V1",
      "family": "model_proxy",
      "display_name": "Modeled Target Mass Percentile",
      "short_name": "Modeled Target Mass",
      "sort_order": 3,
      "unit": "statewide percentile",
      "format_policy": "percentile_1",
      "definition": "Percentile position of the accepted modeled target-mass output among computable Michigan tracts.",
      "interpretation": "Use only as relative statewide context. It is not a site-level forecast, final recommendation, or promise of sales.",
      "source_label": "Accepted MODEL-13 Michigan modeled target-mass output",
      "vintage_label": "2024 public-source inputs",
      "scale_policy": "fixed_0_100",
      "availability_category": "model13_computability",
      "contextual_warning_policy": "model_noncomputability_and_relevant_support",
      "palette": "blue_teal_sequential",
      "binding": {"table": "Michigan Tracts", "column": "Modeled Target Mass Percentile"}
    },
    {
      "metric_key": "median_household_income",
      "source_authority_id": "DATA04_MICHIGAN_PUBLIC_DATA_PARITY_SOURCE_CONTRACT_V1",
      "family": "economic_capacity",
      "display_name": "Median Household Income",
      "short_name": "Median Household Income",
      "sort_order": 4,
      "unit": "2024 inflation-adjusted dollars",
      "format_policy": "currency_0",
      "definition": "Median household income in the past 12 months for households in the tract.",
      "interpretation": "A descriptive household economic measure; it is not Average Household Income or Area Median Income.",
      "source_label": "U.S. Census Bureau, American Community Survey",
      "vintage_label": "2020-2024 ACS 5-Year Detailed Tables",
      "scale_policy": "statewide_valid_p02_p98",
      "availability_category": "data04_measure_status",
      "contextual_warning_policy": "data04_measure_status_only",
      "palette": "blue_teal_sequential",
      "binding": {"table": "Michigan Public Context", "column": "Median Household Income", "status_column": "Median Household Income Status", "moe_column": "Median Household Income MOE", "status_detail_column": "Median Household Income Status Detail"}
    },
    {
      "metric_key": "per_capita_income",
      "source_authority_id": "DATA04_MICHIGAN_PUBLIC_DATA_PARITY_SOURCE_CONTRACT_V1",
      "family": "economic_capacity",
      "display_name": "Per Capita Income",
      "short_name": "Per Capita Income",
      "sort_order": 5,
      "unit": "2024 inflation-adjusted dollars",
      "format_policy": "currency_0",
      "definition": "Aggregate income in the past 12 months divided by the tract population.",
      "interpretation": "A descriptive per-person income measure; it is not household income or a site forecast.",
      "source_label": "U.S. Census Bureau, American Community Survey",
      "vintage_label": "2020-2024 ACS 5-Year Detailed Tables",
      "scale_policy": "statewide_valid_p02_p98",
      "availability_category": "data04_measure_status",
      "contextual_warning_policy": "data04_measure_status_only",
      "palette": "blue_teal_sequential",
      "binding": {"table": "Michigan Public Context", "column": "Per Capita Income", "status_column": "Per Capita Income Status", "moe_column": "Per Capita Income MOE", "status_detail_column": "Per Capita Income Status Detail"}
    },
    {
      "metric_key": "civilian_labor_force_share",
      "source_authority_id": "DATA04_MICHIGAN_PUBLIC_DATA_PARITY_SOURCE_CONTRACT_V1",
      "family": "economic_capacity",
      "display_name": "Civilian Labor Force Share",
      "short_name": "Labor Force Share",
      "sort_order": 6,
      "unit": "percent of population age 16+",
      "format_policy": "percent_1",
      "definition": "Civilian labor force as a share of the population age 16 years and over.",
      "interpretation": "A descriptive labor-force participation measure, not employment-to-population and not a score.",
      "source_label": "U.S. Census Bureau, American Community Survey",
      "vintage_label": "2020-2024 ACS 5-Year Detailed Tables",
      "scale_policy": "statewide_valid_p02_p98",
      "availability_category": "data04_measure_status",
      "contextual_warning_policy": "data04_measure_status_only",
      "palette": "blue_teal_sequential",
      "binding": {"table": "Michigan Public Context", "column": "Civilian Labor Force Share", "status_column": "Civilian Labor Force Share Status", "moe_column": "Civilian Labor Force Share MOE", "status_detail_column": "Civilian Labor Force Share Status Detail"}
    },
    {
      "metric_key": "employment_rate",
      "source_authority_id": "DATA04_MICHIGAN_PUBLIC_DATA_PARITY_SOURCE_CONTRACT_V1",
      "family": "economic_capacity",
      "display_name": "Employment Rate",
      "short_name": "Employment Rate",
      "sort_order": 7,
      "unit": "percent of civilian labor force",
      "format_policy": "percent_1",
      "definition": "Employed civilians divided by the civilian labor force.",
      "interpretation": "This is the employment share of the civilian labor force, not an employment-to-population rate.",
      "source_label": "U.S. Census Bureau, American Community Survey",
      "vintage_label": "2020-2024 ACS 5-Year Detailed Tables",
      "scale_policy": "statewide_valid_p02_p98",
      "availability_category": "data04_measure_status",
      "contextual_warning_policy": "data04_measure_status_only",
      "palette": "blue_teal_sequential",
      "binding": {"table": "Michigan Public Context", "column": "Employment Rate", "status_column": "Employment Rate Status", "moe_column": "Employment Rate MOE", "status_detail_column": "Employment Rate Status Detail"}
    },
    {
      "metric_key": "bachelors_or_higher_share",
      "source_authority_id": "DATA04_MICHIGAN_PUBLIC_DATA_PARITY_SOURCE_CONTRACT_V1",
      "family": "education_socioeconomic_structure",
      "display_name": "Bachelor's Degree or Higher Share",
      "short_name": "Bachelor's or Higher",
      "sort_order": 8,
      "unit": "percent of population age 25+",
      "format_policy": "percent_1",
      "definition": "People age 25 years and over with a bachelor's, master's, professional, or doctoral degree as a share of the age-25-plus population.",
      "interpretation": "A descriptive educational-attainment measure; it is not a direct customer identity or protected-class measure.",
      "source_label": "U.S. Census Bureau, American Community Survey",
      "vintage_label": "2020-2024 ACS 5-Year Detailed Tables",
      "scale_policy": "statewide_valid_p02_p98",
      "availability_category": "data04_measure_status",
      "contextual_warning_policy": "data04_measure_status_only",
      "palette": "blue_teal_sequential",
      "binding": {"table": "Michigan Public Context", "column": "Bachelor's Degree or Higher Share", "status_column": "Bachelor's Degree or Higher Share Status", "moe_column": "Bachelor's Degree or Higher Share MOE", "status_detail_column": "Bachelor's Degree or Higher Share Status Detail"}
    },
    {
      "metric_key": "owner_occupancy_share",
      "source_authority_id": "DATA04_MICHIGAN_PUBLIC_DATA_PARITY_SOURCE_CONTRACT_V1",
      "family": "housing_neighborhood_economics",
      "display_name": "Owner-Occupied Housing Share",
      "short_name": "Owner Occupancy",
      "sort_order": 9,